name,price_usd,calories,restaurant_name,identifier,sugars_g,cholesterol_mg,protein_g,fiber_g,fat_g,carbohydrates_g,sodium_mg
U1. PEKING DUCK 北京烤鸭,20.45,,TASTE OF CHENGDU 成都味道,"UBEREATS, CARROLLTON, TX",,,,,,,
N6. COMBINATION FRIED RICE 什锦炒饭,9.95,,TASTE OF CHENGDU 成都味道,"UBEREATS, CARROLLTON, TX",,,,,,,
V8. MA PO TOFU 麻婆豆腐,11.45,,TASTE OF CHENGDU 成都味道,"UBEREATS, CARROLLTON, TX",,,,,,,
HOT AND SPICY DRY POT 麻辣香锅,13.3,,TASTE OF CHENGDU 成都味道,"UBEREATS, CARROLLTON, TX",,,,,,,
V11. EGGPLANT WITH SPICY GARLIC SAUCE 鱼香茄子,11.45,,TASTE OF CHENGDU 成都味道,"UBEREATS, CARROLLTON, TX",,,,,,,
A1. SPRING ROLL 上海春卷,2.5,,TASTE OF CHENGDU 成都味道,"UBEREATS, CARROLLTON, TX",,,,,,,
A2. CRAB RANGOON 炸蟹角,4.95,,TASTE OF CHENGDU 成都味道,"UBEREATS, CARROLLTON, TX",,,,,,,
A3. SCALLION PANCAKES 葱油饼,4.95,,TASTE OF CHENGDU 成都味道,"UBEREATS, CARROLLTON, TX",,,,,,,
A4. PAN-FRIED PORK DUMPLINGS 锅贴,5.95,,TASTE OF CHENGDU 成都味道,"UBEREATS, CARROLLTON, TX",,,,,,,
A5. STEAMED BUNS 小笼包,5.95,,TASTE OF CHENGDU 成都味道,"UBEREATS, CARROLLTON, TX",,,,,,,
A6. DANDAN NOODLES 担担面,5.95,,TASTE OF CHENGDU 成都味道,"UBEREATS, CARROLLTON, TX",,,,,,,
A7. CHENGDU COLD-NOODLES 成都凉面,6.95,,TASTE OF CHENGDU 成都味道,"UBEREATS, CARROLLTON, TX",,,,,,,
A8. PORK WONTON IN CHILI OIL 红油抄手,5.95,,TASTE OF CHENGDU 成都味道,"UBEREATS, CARROLLTON, TX",,,,,,,
A9. PORK WONTON IN CHICKEN SOUP 鸡汤抄手,5.95,,TASTE OF CHENGDU 成都味道,"UBEREATS, CARROLLTON, TX",,,,,,,
A10. PORK DUMPLINGS IN RED CHILI SAUCE 红油水饺,5.95,,TASTE OF CHENGDU 成都味道,"UBEREATS, CARROLLTON, TX",,,,,,,
A11. CHENGDU DUMPLINGS IN HOT SOY SAUCE 钟水饺,5.95,,TASTE OF CHENGDU 成都味道,"UBEREATS, CARROLLTON, TX",,,,,,,
A12. CHENGDU CLEAR NOODLES IN HOT AND SOUR SOUP 成都酸辣粉,6.95,,TASTE OF CHENGDU 成都味道,"UBEREATS, CARROLLTON, TX",,,,,,,
A13. CHENGDU MUNG BEAN JELLY IN HOT SAUCE 成都凉粉,4.95,,TASTE OF CHENGDU 成都味道,"UBEREATS, CARROLLTON, TX",,,,,,,
D1. CHILLED CHICKEN IN SPICY SAUCE 天府口水鸡,9.95,,TASTE OF CHENGDU 成都味道,"UBEREATS, CARROLLTON, TX",,,,,,,
D2. SLICED BEEF AND TRIPE IN HOT CHILI OIL 夫妻肺片,9.95,,TASTE OF CHENGDU 成都味道,"UBEREATS, CARROLLTON, TX",,,,,,,
D3. SLICED PORK BELLY IN GARLIC SOY SAUCE 蒜泥白肉,8.95,,TASTE OF CHENGDU 成都味道,"UBEREATS, CARROLLTON, TX",,,,,,,
D4. TOFU SKIN SALAD 凉拌腐皮丝,7.95,,TASTE OF CHENGDU 成都味道,"UBEREATS, CARROLLTON, TX",,,,,,,
D5. SPICY TOFU SKIN SALAD 麻辣腐皮丝,7.95,,TASTE OF CHENGDU 成都味道,"UBEREATS, CARROLLTON, TX",,,,,,,
D6. BLACK FUNGUS WITH WILD PEPPER 山椒黑木耳,5.95,,TASTE OF CHENGDU 成都味道,"UBEREATS, CARROLLTON, TX",,,,,,,
D7. CUCUMBER STRIPS IN GARLIC SAUCE 蒜泥黄瓜,4.95,,TASTE OF CHENGDU 成都味道,"UBEREATS, CARROLLTON, TX",,,,,,,
D8. CUCUMBER STRIPS WITH DRY RED PEPPER 炝黄瓜,4.95,,TASTE OF CHENGDU 成都味道,"UBEREATS, CARROLLTON, TX",,,,,,,
S1. EGG DROP SOUP 蛋花汤,3.0,,TASTE OF CHENGDU 成都味道,"UBEREATS, CARROLLTON, TX",,,,,,,
S2. HOT AND SOUR SOUP 酸辣汤,3.0,,TASTE OF CHENGDU 成都味道,"UBEREATS, CARROLLTON, TX",,,,,,,
S3. WONTON SOUP 云吞汤,3.0,,TASTE OF CHENGDU 成都味道,"UBEREATS, CARROLLTON, TX",,,,,,,
S4. WEST LAKE BEEF SOUP 西湖牛肉羹,7.95,,TASTE OF CHENGDU 成都味道,"UBEREATS, CARROLLTON, TX",,,,,,,
S5. CHICKEN SWEET CORN SOUP 鸡茸粟米羹,7.95,,TASTE OF CHENGDU 成都味道,"UBEREATS, CARROLLTON, TX",,,,,,,
S6. SPARE RIBS SOUP 排骨汤,7.95,,TASTE OF CHENGDU 成都味道,"UBEREATS, CARROLLTON, TX",,,,,,,
S7. FISH WITH PICKLED CABBAGE SOUP 酸菜鱼片汤,7.95,,TASTE OF CHENGDU 成都味道,"UBEREATS, CARROLLTON, TX",,,,,,,
S8. HOMEMADE STYLE PORK TROTTERS SOUP 老妈蹄花汤,9.95,,TASTE OF CHENGDU 成都味道,"UBEREATS, CARROLLTON, TX",,,,,,,
S9. OXTAIL WITH CHINESE YAM SOUP 牛尾山药汤,14.95,,TASTE OF CHENGDU 成都味道,"UBEREATS, CARROLLTON, TX",,,,,,,
C1. SEAFOOD IN HOT POT 热盆景,29.45,,TASTE OF CHENGDU 成都味道,"UBEREATS, CARROLLTON, TX",,,,,,,
C2. SPICY AND NUMBING COMBINATION IN HOT POT 极品一锅端,18.45,,TASTE OF CHENGDU 成都味道,"UBEREATS, CARROLLTON, TX",,,,,,,
C3. SPICY COMBINATION IN HOT POT 毛血旺,18.45,,TASTE OF CHENGDU 成都味道,"UBEREATS, CARROLLTON, TX",,,,,,,
U1. DUCK BONE SOUP 鸭架汤,5.0,,TASTE OF CHENGDU 成都味道,"UBEREATS, CARROLLTON, TX",,,,,,,
U1. DUCK BONE WITH WHITE PEPPER AND SALT 椒盐鸭架,5.0,,TASTE OF CHENGDU 成都味道,"UBEREATS, CARROLLTON, TX",,,,,,,
U2. SHREDDED DUCK WITH SWEET BEAN SAUCE 京酱鸭丝,19.45,,TASTE OF CHENGDU 成都味道,"UBEREATS, CARROLLTON, TX",,,,,,,
P1. HOMEMADE STYLE SPICY PORK FEET 乡村小炒蹄,16.45,,TASTE OF CHENGDU 成都味道,"UBEREATS, CARROLLTON, TX",,,,,,,
P2. PORK INTESTINES WITH PICKED CHILI 泡椒肥肠,16.45,,TASTE OF CHENGDU 成都味道,"UBEREATS, CARROLLTON, TX",,,,,,,
P3. SPICY PORK INTESTINES 香辣肥肠,16.45,,TASTE OF CHENGDU 成都味道,"UBEREATS, CARROLLTON, TX",,,,,,,
P4. DRY-POT PORK INTESTINE 干锅肥肠,16.45,,TASTE OF CHENGDU 成都味道,"UBEREATS, CARROLLTON, TX",,,,,,,
P5. PORK STEW IN BROWN SAUCE 红烧肉,15.45,,TASTE OF CHENGDU 成都味道,"UBEREATS, CARROLLTON, TX",,,,,,,
P6. CHENGDU SPARE RIBS 成都小排骨,15.45,,TASTE OF CHENGDU 成都味道,"UBEREATS, CARROLLTON, TX",,,,,,,
P7. PAPER WRAPPED SPARE RIBS 纸包排骨,15.45,,TASTE OF CHENGDU 成都味道,"UBEREATS, CARROLLTON, TX",,,,,,,
P8. CUMIN SPARE RIBS 孜然排骨,15.45,,TASTE OF CHENGDU 成都味道,"UBEREATS, CARROLLTON, TX",,,,,,,
P9. DRY-POT SPARE RIBS 干锅排骨,15.45,,TASTE OF CHENGDU 成都味道,"UBEREATS, CARROLLTON, TX",,,,,,,
P10. SMOKED PORK BELLY WITH TEA TREE MUSHROOM 茶树菇腊肉,15.45,,TASTE OF CHENGDU 成都味道,"UBEREATS, CARROLLTON, TX",,,,,,,
P11. SMOKED PORK BELLY WITH LEEK 蒜苗腊肉,14.45,,TASTE OF CHENGDU 成都味道,"UBEREATS, CARROLLTON, TX",,,,,,,
P12. PORK WITH HOT SAUCE 水煮肉片,14.45,,TASTE OF CHENGDU 成都味道,"UBEREATS, CARROLLTON, TX",,,,,,,
P13. STIR-FRIED PORK KIDNEY 炝炒腰花,13.45,,TASTE OF CHENGDU 成都味道,"UBEREATS, CARROLLTON, TX",,,,,,,
P14. HOMEMADE STYLE PORK WITH LEEK AND JALAPENO 农家小炒肉,13.45,,TASTE OF CHENGDU 成都味道,"UBEREATS, CARROLLTON, TX",,,,,,,
P15. DOUBLE COOKED PORK 回锅肉,13.45,,TASTE OF CHENGDU 成都味道,"UBEREATS, CARROLLTON, TX",,,,,,,
P16. SHREDDED PORK WITH SWEET BEAN SAUCE 京酱肉丝,13.45,,TASTE OF CHENGDU 成都味道,"UBEREATS, CARROLLTON, TX",,,,,,,
P17. SHREDDED PORK WITH GREEN PEPPER 小椒肉丝,11.45,,TASTE OF CHENGDU 成都味道,"UBEREATS, CARROLLTON, TX",,,,,,,
P18. CLEAR NOODLE WITH SPICY MINCED PORK 蚂蚁上树,11.45,,TASTE OF CHENGDU 成都味道,"UBEREATS, CARROLLTON, TX",,,,,,,
P19. SHREDDED PORK WITH SHREDDED VEGETABLES 木须肉,11.45,,TASTE OF CHENGDU 成都味道,"UBEREATS, CARROLLTON, TX",,,,,,,
P20. SHREDDED PORK WITH BAMBOO SHOOT 笋尖肉丝,11.45,,TASTE OF CHENGDU 成都味道,"UBEREATS, CARROLLTON, TX",,,,,,,
P21. SHREDDED PORK WITH DRY BEAN CURD 香干肉丝,11.45,,TASTE OF CHENGDU 成都味道,"UBEREATS, CARROLLTON, TX",,,,,,,
P22. SHREDDED PORK WITH SPICY GARLIC SAUCE 鱼香肉丝,11.45,,TASTE OF CHENGDU 成都味道,"UBEREATS, CARROLLTON, TX",,,,,,,
B1. THIN-SLICED BEEF IN PICKED CABBAGE SOUP 酸汤肥牛,18.45,,TASTE OF CHENGDU 成都味道,"UBEREATS, CARROLLTON, TX",,,,,,,
B2. BEEF TRIPE WITH HOT SAUCE 水煮牛百叶,16.45,,TASTE OF CHENGDU 成都味道,"UBEREATS, CARROLLTON, TX",,,,,,,
B3. DRY-POT STYLE BEEF 干锅牛,16.45,,TASTE OF CHENGDU 成都味道,"UBEREATS, CARROLLTON, TX",,,,,,,
B4. BEEF WITH HOT SAUCE 水煮牛,16.45,,TASTE OF CHENGDU 成都味道,"UBEREATS, CARROLLTON, TX",,,,,,,
B5. BEEF WITH PICKLED CHILI 泡椒牛,16.45,,TASTE OF CHENGDU 成都味道,"UBEREATS, CARROLLTON, TX",,,,,,,
B6. CUMIN BEEF 孜然牛,16.45,,TASTE OF CHENGDU 成都味道,"UBEREATS, CARROLLTON, TX",,,,,,,
B7. SZECHUAN BEEF BELLY STEW 四川牛腩煲,15.45,,TASTE OF CHENGDU 成都味道,"UBEREATS, CARROLLTON, TX",,,,,,,
B8. CHENGDU SPICY SHREDDED BEEF 成都牛条,15.45,,TASTE OF CHENGDU 成都味道,"UBEREATS, CARROLLTON, TX",,,,,,,
B9. BASIL BEEF 九层塔牛,15.45,,TASTE OF CHENGDU 成都味道,"UBEREATS, CARROLLTON, TX",,,,,,,
B10. BEEF WITH GREEN PEPPER 小椒牛肉丝,14.45,,TASTE OF CHENGDU 成都味道,"UBEREATS, CARROLLTON, TX",,,,,,,
B11. SHREDDED BEEF WITH ASPARAGUS 芦笋牛肉丝,14.45,,TASTE OF CHENGDU 成都味道,"UBEREATS, CARROLLTON, TX",,,,,,,
B12. BEEF WITH SPICY GARLIC SAUCE 鱼香牛,14.45,,TASTE OF CHENGDU 成都味道,"UBEREATS, CARROLLTON, TX",,,,,,,
B13. ORANGE BEEF 陈皮牛,14.45,,TASTE OF CHENGDU 成都味道,"UBEREATS, CARROLLTON, TX",,,,,,,
B14. SESAME BEEF 芝麻牛,14.45,,TASTE OF CHENGDU 成都味道,"UBEREATS, CARROLLTON, TX",,,,,,,
B15. BEEF WITH FERMENTED SOYBEAN SAUCE 豉汁牛,14.45,,TASTE OF CHENGDU 成都味道,"UBEREATS, CARROLLTON, TX",,,,,,,
B16. TRIPLE MUSHROOMS WITH BEEF 三菇牛,13.45,,TASTE OF CHENGDU 成都味道,"UBEREATS, CARROLLTON, TX",,,,,,,
B17. STIR-FRIED BEEF WITH SCALLION 葱爆牛,13.45,,TASTE OF CHENGDU 成都味道,"UBEREATS, CARROLLTON, TX",,,,,,,
B18. SHREDDED BEEF WITH SHREDDED VEGETABLES 木须牛,13.45,,TASTE OF CHENGDU 成都味道,"UBEREATS, CARROLLTON, TX",,,,,,,
B19. BEEF AND BROCCOLI 芥兰牛,12.45,,TASTE OF CHENGDU 成都味道,"UBEREATS, CARROLLTON, TX",,,,,,,
B20. BEEF WITH GREEN PEPPER 青椒牛,12.45,,TASTE OF CHENGDU 成都味道,"UBEREATS, CARROLLTON, TX",,,,,,,
B21. BEEF WITH VEGETABLES 蔬菜牛,12.45,,TASTE OF CHENGDU 成都味道,"UBEREATS, CARROLLTON, TX",,,,,,,
K1. CHONGQING SPICY CHICKEN 重庆辣子鸡,14.45,,TASTE OF CHENGDU 成都味道,"UBEREATS, CARROLLTON, TX",,,,,,,
K2. ROAST CHICKEN 烧鸡公,18.45,,TASTE OF CHENGDU 成都味道,"UBEREATS, CARROLLTON, TX",,,,,,,
K3. STEWED CHICKEN WITH GINGER AND WINE IN CASSEROLE 三杯鸡,14.45,,TASTE OF CHENGDU 成都味道,"UBEREATS, CARROLLTON, TX",,,,,,,
K4. CHICKEN WITH HOT SAUCE 水煮鸡,14.45,,TASTE OF CHENGDU 成都味道,"UBEREATS, CARROLLTON, TX",,,,,,,
K5. STIR-FRIED SPICY MINCED CHICKEN WITH BEAN SPROUTS 鸡米芽菜,14.45,,TASTE OF CHENGDU 成都味道,"UBEREATS, CARROLLTON, TX",,,,,,,
K6. KUNG PAO CHICKEN 宫保鸡丁,13.45,,TASTE OF CHENGDU 成都味道,"UBEREATS, CARROLLTON, TX",,,,,,,
K7. SESAME CHICKEN 芝麻鸡,13.45,,TASTE OF CHENGDU 成都味道,"UBEREATS, CARROLLTON, TX",,,,,,,
K5. GENERAL TSO'S CHICKEN 左宗鸡,13.45,,TASTE OF CHENGDU 成都味道,"UBEREATS, CARROLLTON, TX",,,,,,,
K6. ORANGE CHICKEN 陈皮鸡,13.45,,TASTE OF CHENGDU 成都味道,"UBEREATS, CARROLLTON, TX",,,,,,,
K7. SWEET AND SOUR CHICKEN 甜酸鸡,13.45,,TASTE OF CHENGDU 成都味道,"UBEREATS, CARROLLTON, TX",,,,,,,
K8. TRIPLE MUSHROOMS WITH CHICKEN 三菇鸡,12.45,,TASTE OF CHENGDU 成都味道,"UBEREATS, CARROLLTON, TX",,,,,,,
K9. CHICKEN WITH WHITE PEPPER AND SALT 椒盐鸡丁,12.45,,TASTE OF CHENGDU 成都味道,"UBEREATS, CARROLLTON, TX",,,,,,,
K10. BASIL CHICKEN 九层塔鸡,12.45,,TASTE OF CHENGDU 成都味道,"UBEREATS, CARROLLTON, TX",,,,,,,
K11. CHICKEN WITH SPICY GARLIC SAUCE 鱼香鸡,11.45,,TASTE OF CHENGDU 成都味道,"UBEREATS, CARROLLTON, TX",,,,,,,
K12. CHICKEN WITH BROCCOLI 芥兰鸡,11.45,,TASTE OF CHENGDU 成都味道,"UBEREATS, CARROLLTON, TX",,,,,,,
K13. CHICKEN WITH VEGETABLES 蔬菜鸡,11.45,,TASTE OF CHENGDU 成都味道,"UBEREATS, CARROLLTON, TX",,,,,,,
K14. CASHEW CHICKEN 腰果鸡,11.45,,TASTE OF CHENGDU 成都味道,"UBEREATS, CARROLLTON, TX",,,,,,,
K15. STIR-FRIED CHICKEN WITH SCALLION 葱爆鸡,11.45,,TASTE OF CHENGDU 成都味道,"UBEREATS, CARROLLTON, TX",,,,,,,
L1. NEW ZEALAND BBQ LAMB CHOPS 新西兰烤羊排,29.45,,TASTE OF CHENGDU 成都味道,"UBEREATS, CARROLLTON, TX",,,,,,,
L2. CUMIN LAMB 孜然羊,16.45,,TASTE OF CHENGDU 成都味道,"UBEREATS, CARROLLTON, TX",,,,,,,
L3. LAMB WITH HOT SAUCE 水煮羊,16.45,,TASTE OF CHENGDU 成都味道,"UBEREATS, CARROLLTON, TX",,,,,,,
L4. DRY-POT LAMB 干锅羊,16.45,,TASTE OF CHENGDU 成都味道,"UBEREATS, CARROLLTON, TX",,,,,,,
L5. STIR-FRIED LAMB WITH SCALLIONS 葱爆羊,14.45,,TASTE OF CHENGDU 成都味道,"UBEREATS, CARROLLTON, TX",,,,,,,
F7. FISH FILLET WITH PICKLED CABBAGE POT 酸菜鱼片锅,21.45,,TASTE OF CHENGDU 成都味道,"UBEREATS, CARROLLTON, TX",,,,,,,
F8. FISH WITH SEASONING IN COLD POT 冷锅鱼,19.45,,TASTE OF CHENGDU 成都味道,"UBEREATS, CARROLLTON, TX",,,,,,,
F9. FISH FILLET WITH HOT CHILI OIL 沸腾鱼片,18.45,,TASTE OF CHENGDU 成都味道,"UBEREATS, CARROLLTON, TX",,,,,,,
F10. SZECHUAN POLA FISH 川西泼辣鱼,15.45,,TASTE OF CHENGDU 成都味道,"UBEREATS, CARROLLTON, TX",,,,,,,
F11. FRIED FISH FILLET WITH RED CHILI OIL 特味烤鱼片,15.45,,TASTE OF CHENGDU 成都味道,"UBEREATS, CARROLLTON, TX",,,,,,,
F12. FISH FILLET WITH WHITE SAUCE 鲜溜鱼片,15.45,,TASTE OF CHENGDU 成都味道,"UBEREATS, CARROLLTON, TX",,,,,,,
F13. FISH FILLET WITH HOT SAUCE 水煮鱼,15.45,,TASTE OF CHENGDU 成都味道,"UBEREATS, CARROLLTON, TX",,,,,,,
F14. FISH FILLET WITH PICKLED CHILI 泡椒鱼片,15.45,,TASTE OF CHENGDU 成都味道,"UBEREATS, CARROLLTON, TX",,,,,,,
F15. STEAMED FISH WITH TOFU 清蒸豆花鱼,15.45,,TASTE OF CHENGDU 成都味道,"UBEREATS, CARROLLTON, TX",,,,,,,
F16. SPICY AND NUMBING FISH WITH TOFU 麻辣豆花鱼,15.45,,TASTE OF CHENGDU 成都味道,"UBEREATS, CARROLLTON, TX",,,,,,,
F17. FISH FILLET WITH FERMENTED SOY BEAN SAUCE 豉汁鱼,15.45,,TASTE OF CHENGDU 成都味道,"UBEREATS, CARROLLTON, TX",,,,,,,
F18. CHENGDU FRESH SPICY FISH成都跳水鱼,26.45,,TASTE OF CHENGDU 成都味道,"UBEREATS, CARROLLTON, TX",,,,,,,
E1. BULLFROG WITH DOUBLE CHILI PEPPER 双椒牛蛙,26.45,,TASTE OF CHENGDU 成都味道,"UBEREATS, CARROLLTON, TX",,,,,,,
E2. SAVORY SPICY SHRIMP WITH DRIED RED PEPPER 干煸大虾,18.45,,TASTE OF CHENGDU 成都味道,"UBEREATS, CARROLLTON, TX",,,,,,,
E3. DRY-POT SHRIMP 干锅虾,17.45,,TASTE OF CHENGDU 成都味道,"UBEREATS, CARROLLTON, TX",,,,,,,
E4. SCALLOP WITH VEGETABLE 时蔬干贝,16.45,,TASTE OF CHENGDU 成都味道,"UBEREATS, CARROLLTON, TX",,,,,,,
E5. SCALLOP WITH SPICY GARLIC SAUCE 鱼香干贝,16.45,,TASTE OF CHENGDU 成都味道,"UBEREATS, CARROLLTON, TX",,,,,,,
E6. SHRIMP WITH SPICY GARLIC SAUCE 鱼香虾,16.45,,TASTE OF CHENGDU 成都味道,"UBEREATS, CARROLLTON, TX",,,,,,,
E7. KUNG PAO SHRIMP 宫保虾,16.45,,TASTE OF CHENGDU 成都味道,"UBEREATS, CARROLLTON, TX",,,,,,,
E8. SHRIMP WITH WHITE PEPPER AND SALT 椒盐虾,16.45,,TASTE OF CHENGDU 成都味道,"UBEREATS, CARROLLTON, TX",,,,,,,
E9. SAUTEED SHRIMP 清炒虾仁,16.45,,TASTE OF CHENGDU 成都味道,"UBEREATS, CARROLLTON, TX",,,,,,,
E10. SHRIMP WITH FERMENTED SOYBEAN SAUCE 豉汁虾,16.45,,TASTE OF CHENGDU 成都味道,"UBEREATS, CARROLLTON, TX",,,,,,,
E11. BASIL SHRIMP 九层塔虾,16.45,,TASTE OF CHENGDU 成都味道,"UBEREATS, CARROLLTON, TX",,,,,,,
E12. SQUID WITH PICKED CHILI 泡椒鱿鱼,15.45,,TASTE OF CHENGDU 成都味道,"UBEREATS, CARROLLTON, TX",,,,,,,
E13. SHRIMP AND TOFU WITH WHITE SAUCE 虾仁豆腐,14.45,,TASTE OF CHENGDU 成都味道,"UBEREATS, CARROLLTON, TX",,,,,,,
E14. SQUID WITH WHITE PEPPER AND SALT 椒盐鱿鱼,14.45,,TASTE OF CHENGDU 成都味道,"UBEREATS, CARROLLTON, TX",,,,,,,
V1. STIR-FRIED SNOW PEA LEAVES 炒豆苗,15.45,,TASTE OF CHENGDU 成都味道,"UBEREATS, CARROLLTON, TX",,,,,,,
V2. SNOW PEA LEAVES IN CHICKEN BROTH AND SHRIMP 上汤豆苗,16.45,,TASTE OF CHENGDU 成都味道,"UBEREATS, CARROLLTON, TX",,,,,,,
V3. DRY-POT TEA TREE MUSHROOM 干锅茶树菇,16.45,,TASTE OF CHENGDU 成都味道,"UBEREATS, CARROLLTON, TX",,,,,,,
V4. TOFU SKIN AND BOK CHOY 腐皮菜心,13.45,,TASTE OF CHENGDU 成都味道,"UBEREATS, CARROLLTON, TX",,,,,,,
V5. NAPA CABBAGE AND DRIED SHRIMP 开阳白菜,13.45,,TASTE OF CHENGDU 成都味道,"UBEREATS, CARROLLTON, TX",,,,,,,
V6. HOMEMADE STYLE TOFU 家常豆腐,13.45,,TASTE OF CHENGDU 成都味道,"UBEREATS, CARROLLTON, TX",,,,,,,
V7. TOFU AND VEGETABLE STEW 蔬菜豆腐煲,12.45,,TASTE OF CHENGDU 成都味道,"UBEREATS, CARROLLTON, TX",,,,,,,
V9. DRY-SAUTEED STRING BEANS 干煸四季豆,11.45,,TASTE OF CHENGDU 成都味道,"UBEREATS, CARROLLTON, TX",,,,,,,
V10. SPICY DRY-SAUTEED STRING BEANS 椒麻四季豆,11.45,,TASTE OF CHENGDU 成都味道,"UBEREATS, CARROLLTON, TX",,,,,,,
V12. DRIED BEAN CURD WITH CELERY 中芹香干,11.45,,TASTE OF CHENGDU 成都味道,"UBEREATS, CARROLLTON, TX",,,,,,,
V13. SAUTEED GREEN HOT PEPPER 虎皮青椒,11.45,,TASTE OF CHENGDU 成都味道,"UBEREATS, CARROLLTON, TX",,,,,,,
V14. STIR-FRIED CABBAGE WITH SUGAR AND VINEGAR 糖醋炒莲花白,11.45,,TASTE OF CHENGDU 成都味道,"UBEREATS, CARROLLTON, TX",,,,,,,
V14. STIR-FRIED CABBAGE WITH DRY RED PEPPER 炝炒莲花白,11.45,,TASTE OF CHENGDU 成都味道,"UBEREATS, CARROLLTON, TX",,,,,,,
V15. SWEET AND SOUR NAPA CABBAGE 醋溜白菜,11.45,,TASTE OF CHENGDU 成都味道,"UBEREATS, CARROLLTON, TX",,,,,,,
V16. MUSHROOM AND BOK CHOY 冬菇菜心,11.45,,TASTE OF CHENGDU 成都味道,"UBEREATS, CARROLLTON, TX",,,,,,,
V17. STIR-FRIED SHREDDED POTATO AND GREEN PEPPER 青椒炒土豆丝,11.45,,TASTE OF CHENGDU 成都味道,"UBEREATS, CARROLLTON, TX",,,,,,,
V17. STIR-FRIED SHREDDED POTATO AND DRY RED PEPPER 炝炒土豆丝,11.45,,TASTE OF CHENGDU 成都味道,"UBEREATS, CARROLLTON, TX",,,,,,,
V17. STIR-FRIED SHREDDED POTATO WITH SPICY AND SOUR SAUCE 酸辣土豆丝,11.45,,TASTE OF CHENGDU 成都味道,"UBEREATS, CARROLLTON, TX",,,,,,,
V18. STIR-FRIED TOMATO WITH EGGS 番茄炒蛋,11.45,,TASTE OF CHENGDU 成都味道,"UBEREATS, CARROLLTON, TX",,,,,,,
V19. VEGETABLE DELUXE 素什锦,10.45,,TASTE OF CHENGDU 成都味道,"UBEREATS, CARROLLTON, TX",,,,,,,
N1. SPICY BEEF NOODLE SOUP 川味牛肉面,7.95,,TASTE OF CHENGDU 成都味道,"UBEREATS, CARROLLTON, TX",,,,,,,
N2. BRAISED BEEF NOODLE SOUP 红烧牛肉面,7.95,,TASTE OF CHENGDU 成都味道,"UBEREATS, CARROLLTON, TX",,,,,,,
N3. SEAFOOD NOODLE SOUP 海鲜汤面,7.95,,TASTE OF CHENGDU 成都味道,"UBEREATS, CARROLLTON, TX",,,,,,,
N4. SHREDDED DUCK NOODLE SOUP 鸭丝面,9.95,,TASTE OF CHENGDU 成都味道,"UBEREATS, CARROLLTON, TX",,,,,,,
N5. STIR-FRIED RICE CAKE 炒年糕,8.95,,TASTE OF CHENGDU 成都味道,"UBEREATS, CARROLLTON, TX",,,,,,,
N7. CHICKEN FRIED RICE 鸡炒饭,8.95,,TASTE OF CHENGDU 成都味道,"UBEREATS, CARROLLTON, TX",,,,,,,
N7. BEEF FRIED RICE 牛炒饭,8.95,,TASTE OF CHENGDU 成都味道,"UBEREATS, CARROLLTON, TX",,,,,,,
N7. SHRIMP FRIED RICE 虾炒饭,8.95,,TASTE OF CHENGDU 成都味道,"UBEREATS, CARROLLTON, TX",,,,,,,
N8. COMBINATION LO MEIN 什锦炒面,9.95,,TASTE OF CHENGDU 成都味道,"UBEREATS, CARROLLTON, TX",,,,,,,
N9. CHICKEN LO MEIN 鸡炒面,8.95,,TASTE OF CHENGDU 成都味道,"UBEREATS, CARROLLTON, TX",,,,,,,
N9. BEEF LO MEIN 牛炒面,8.95,,TASTE OF CHENGDU 成都味道,"UBEREATS, CARROLLTON, TX",,,,,,,
N9. SHRIMP LO MEIN 虾炒面,8.95,,TASTE OF CHENGDU 成都味道,"UBEREATS, CARROLLTON, TX",,,,,,,
G2. PUMPKIN CAKE 南瓜饼,3.95,,TASTE OF CHENGDU 成都味道,"UBEREATS, CARROLLTON, TX",,,,,,,
G3. BLACK SESAME GLUTINOUS RICE BALLS 芝麻汤圆,3.95,,TASTE OF CHENGDU 成都味道,"UBEREATS, CARROLLTON, TX",,,,,,,
G4. GOLDEN FRIED BUNS 黃金小馒头,3.95,,TASTE OF CHENGDU 成都味道,"UBEREATS, CARROLLTON, TX",,,,,,,
BOTTLE WATER 矿泉水,1.0,,TASTE OF CHENGDU 成都味道,"UBEREATS, CARROLLTON, TX",,,,,,,
SPRITE,1.99,,TASTE OF CHENGDU 成都味道,"UBEREATS, CARROLLTON, TX",,,,,,,
COCA-COLA,1.99,,TASTE OF CHENGDU 成都味道,"UBEREATS, CARROLLTON, TX",,,,,,,
DIET COKE,1.99,,TASTE OF CHENGDU 成都味道,"UBEREATS, CARROLLTON, TX",,,,,,,
SOY MILK 豆奶,1.99,,TASTE OF CHENGDU 成都味道,"UBEREATS, CARROLLTON, TX",,,,,,,
HERBAL TEA 凉茶,1.99,,TASTE OF CHENGDU 成都味道,"UBEREATS, CARROLLTON, TX",,,,,,,
RED BULL 红牛,2.99,,TASTE OF CHENGDU 成都味道,"UBEREATS, CARROLLTON, TX",,,,,,,
HOT TEA 热茶,2.5,,TASTE OF CHENGDU 成都味道,"UBEREATS, CARROLLTON, TX",,,,,,,
CHRYSANTHEMUM TEA 菊花茶,2.5,,TASTE OF CHENGDU 成都味道,"UBEREATS, CARROLLTON, TX",,,,,,,
LS13. BEEF WITH GREEN PEPPER 青椒牛,9.95,,TASTE OF CHENGDU 成都味道,"UBEREATS, CARROLLTON, TX",,,,,,,
LS1. SESAME CHICKEN 芝麻鸡,9.95,,TASTE OF CHENGDU 成都味道,"UBEREATS, CARROLLTON, TX",,,,,,,
LS17. SHRIMP WITH VEGETABLE 蔬菜虾,9.95,,TASTE OF CHENGDU 成都味道,"UBEREATS, CARROLLTON, TX",,,,,,,
LS12. TRIPLE MUSHROOMS WITH BEEF 三菇牛,9.95,,TASTE OF CHENGDU 成都味道,"UBEREATS, CARROLLTON, TX",,,,,,,
LS16. BEEF WITH SPICY GARLIC SAUCE 鱼香牛,9.95,,TASTE OF CHENGDU 成都味道,"UBEREATS, CARROLLTON, TX",,,,,,,
LS2. ORANGE CHICKEN 陈皮鸡,9.95,,TASTE OF CHENGDU 成都味道,"UBEREATS, CARROLLTON, TX",,,,,,,
LS3. GENERAL TSO'S CHICKEN 左宗鸡,9.95,,TASTE OF CHENGDU 成都味道,"UBEREATS, CARROLLTON, TX",,,,,,,
LS4. SWEET AND SOUR CHICKEN 甜酸鸡,9.95,,TASTE OF CHENGDU 成都味道,"UBEREATS, CARROLLTON, TX",,,,,,,
LS5. CHICKEN WITH BROCCOLI 芥兰鸡,8.95,,TASTE OF CHENGDU 成都味道,"UBEREATS, CARROLLTON, TX",,,,,,,
LS6. CHICKEN WITH VEGETABLE 蔬菜鸡,8.95,,TASTE OF CHENGDU 成都味道,"UBEREATS, CARROLLTON, TX",,,,,,,
LS7. CHICKEN WITH MUSHROOM 蘑菇鸡,8.95,,TASTE OF CHENGDU 成都味道,"UBEREATS, CARROLLTON, TX",,,,,,,
LS8. STIR-FRIED CHICKEN WITH SCALLION 葱爆鸡,8.95,,TASTE OF CHENGDU 成都味道,"UBEREATS, CARROLLTON, TX",,,,,,,
LS9. CASHEW CHICKEN 腰果鸡,8.95,,TASTE OF CHENGDU 成都味道,"UBEREATS, CARROLLTON, TX",,,,,,,
LS10. CHICKEN WITH SPICY GARLIC SAUCE 鱼香鸡,8.95,,TASTE OF CHENGDU 成都味道,"UBEREATS, CARROLLTON, TX",,,,,,,
LS11. BEEF WITH BROCCOLI 芥兰牛,9.95,,TASTE OF CHENGDU 成都味道,"UBEREATS, CARROLLTON, TX",,,,,,,
LS14. BEEF WITH VEGETABLE 蔬菜牛,9.95,,TASTE OF CHENGDU 成都味道,"UBEREATS, CARROLLTON, TX",,,,,,,
LS15. STIR-FRIED BEEF WITH SCALLION 葱爆牛,9.95,,TASTE OF CHENGDU 成都味道,"UBEREATS, CARROLLTON, TX",,,,,,,
LS18. SHREDDED PORK WITH DRY BEAN CURD 香干肉丝,8.95,,TASTE OF CHENGDU 成都味道,"UBEREATS, CARROLLTON, TX",,,,,,,
LS19. SHREDDED PORK WITH BAMBOO SHOOT 笋尖肉丝,8.95,,TASTE OF CHENGDU 成都味道,"UBEREATS, CARROLLTON, TX",,,,,,,
LS20. EGGPLANT WITH SPICY GARLIC SAUCE 鱼香茄子,8.95,,TASTE OF CHENGDU 成都味道,"UBEREATS, CARROLLTON, TX",,,,,,,
LS21. DRY SAUTEED STRING BEANS 干煸四季豆,8.95,,TASTE OF CHENGDU 成都味道,"UBEREATS, CARROLLTON, TX",,,,,,,
LS22. VEGETABLE DELUXE 素什锦,8.95,,TASTE OF CHENGDU 成都味道,"UBEREATS, CARROLLTON, TX",,,,,,,
